ste@gmail.com,Wed May 12 00:00:00 GMT-03:00 2004,1,11,Ensino Superior Incompleto,Desenvolvimento Web. Programação. Cybersegurança,,
ste@gmail.com,Sun May 09 00:00:00 GMT-03:00 2004,14437702646,32984207823,Ensino Superior Incompleto,Dados. Inteligência Artificial. Desenvolvimento Web. Programação. Cybersegurança,,

ee@ddd.dd,Wed Nov 10 00:00:00 GMT-02:00 2010,122222222,1234356,Ensino Médio Incompleto,Desenvolvimento Web. Inteligência Artificial. Programação. Mobile,,
SS@DDD.DD,Wed Nov 10 00:00:00 GMT-02:00 2010,3234,4444,Ensino Fundamental Incompleto,Dados. Desenvolvimento Web. Programação,,
ddd@dd.dd,Sun Nov 07 00:00:00 GMT-02:00 2010,21234,21344,Ensino Superior Completo,Desenvolvimento Web. Inteligência Artificial. Programação. Cybersegurança,,
sssj@ss.csss,Thu Nov 11 00:00:00 GMT-02:00 2010,22,33,Ensino Fundamental Completo,,,
stephanye@gmail.com,Wed May 12 00:00:00 GMT-03:00 2004,14437702646,32984207823,Ensino Superior Incompleto,Inteligência Artificial. Desenvolvimento Web. Programação. Cybersegurança,,
