Julia Mendes,MongoDB Tips,Queries NoSQL eficientes,Banco de Dados,2023-05-22,271,34,11,Quais são as melhores práticas para otimizar queries NoSQL em grandes coleções do MongoDB?
Marcos Costa,Vue.js Setup,Configuração inicial Vue.js,Frontend,2023-05-23,170,29,7,Como configurar um projeto Vue.js com Typescript e integrar com ferramentas modernas de desenvolvimento?
Clara Rodrigues,Linux Commands,Comandos essenciais Linux,DevOps,2023-05-24,227,41,16,Quais são os comandos Linux mais importantes para automação de processos em ambientes de produção?
João Silva,Dúvida sobre Java,Como implementar interfaces em Java?,Programação,2023-05-15,155,25,8,Como implementar interfaces em Java para criar sistemas mais flexíveis e seguir o princípio de inversão de dependência?
Maria Santos,SQL Básico,Ajuda com queries SELECT,Banco de Dados,2023-05-16,92,12,5,Como escrever queries SELECT eficientes com JOINs múltiplos e subconsultas para análise de dados complexos?
Pedro Paulo,Python Tips,Melhores práticas em Python,Programação,2023-05-17,238,45,12,Quais são as melhores práticas de desenvolvimento Python para garantir código limpo e manutenível em projetos de grande escala?
Ana Silva,Git Help,Como resolver conflitos no merge?,DevOps,2023-05-18,174,28,15,Como resolver conflitos complexos de merge no Git quando trabalho em equipe com múltiplas branches e features simultâneas?
Rafael Pereira,CSS Flexbox,Tutorial completo de Flexbox,Frontend,2023-05-21,282,56,18,Como implementar layouts responsivos complexos utilizando CSS Flexbox em conjunto com Grid para websites modernos?
